Topic	Text
Final Question	Treating people with dignity.
Final Question	Making sure that everyone has an even chance.
Final Question	Now, I'm going to make sure you get that.
Final Question	You haven't been getting it the last four years.
Final Question	I will say, ‘I’m the American president.
Final Question	I represent all of you whether you voted for me or against me.
Final Question	And I'm going to make sure that you’re represented.
Final Question	I’m going to give you hope.
Final Question	We're going to move.
Final Question	We're going to choose science over fiction.
Final Question	We're going to choose hope over fear.
Final Question	We're going to choose to move forward because we have enormous opportunities, enormous opportunities to make things better.
Final Question	 We can grow this economy.
Final Question	We can deal with a systemic racism.
Final Question	At the same time, we can make sure that our economy is being run, and moved, and motivated by clean energy, creating millions of new jobs.
Final Question	And that's the fact, that's what we're going to do.
Final Question	And I'm going to say, as I said at the beginning, what is on the ballot here is the character of this country.
Final Question	Decency.
Final Question	Honor.
Final Question	Respect.
Final Question	Treating people with dignity.
Final Question	Making sure that everyone has an even chance.
Final Question	Now, I'm going to make sure you get that.
Final Question	You haven't been getting it the last four years.